No,Category,Guideline,Description,Do,Dont,Code Good,Code Bad,Severity,Docs URL
1,Setup,Use #![no_std] for embedded targets,"Embedded Rust uses #![no_std] to compile without the standard library targeting bare-metal systems","Use #![no_std] with #![no_main]; define panic handler; use cortex-m-rt for ARM; use embedded-hal traits for portability",Use std library features on embedded targets; rely on heap allocation,"#![no_std]\n#![no_main]\n\nuse cortex_m_rt::entry;\nuse panic_halt as _;\n\n#[entry]\nfn main() -> ! {\n    let dp = stm32f4::stm32f411::Peripherals::take().unwrap();\n    // configure peripherals\n    loop {\n        // main loop\n    }\n}","use std::collections::HashMap;\n// std is not available on embedded targets\n// HashMap requires heap allocation",Critical,https://docs.rust-embedded.org/book/intro/no-std.html
2,HAL,Use embedded-hal traits for hardware abstraction,"Program against embedded-hal traits for portable driver code that works across different microcontrollers","Use embedded_hal::digital::OutputPin, embedded_hal::i2c::I2c etc; write drivers generic over HAL traits",Write drivers for specific chip registers; hardcode pin assignments,"use embedded_hal::digital::OutputPin;\n\nfn blink<P: OutputPin>(led: &mut P, delay: &mut impl embedded_hal::delay::DelayNs) {\n    led.set_high().unwrap();\n    delay.delay_ms(500);\n    led.set_low().unwrap();\n    delay.delay_ms(500);\n}\n// Works on any chip that implements embedded-hal","fn blink_stm32(gpioa: &mut GPIOA) {\n    unsafe {\n        (*GPIOA::ptr()).odr.modify(|_, w| w.odr5().set_bit());\n        // raw register access, not portable\n    }\n}",High,https://docs.rs/embedded-hal/latest/embedded_hal/
3,Memory,Use static allocation for embedded,"Avoid heap allocation in embedded contexts; use static buffers, heapless collections, and const generics","Use heapless::Vec, heapless::String for bounded collections; use static mut with critical sections; use const generics for buffer sizes",Use Vec or String which require heap allocation; rely on dynamic memory,"use heapless::Vec;\nuse heapless::String;\n\nlet mut buffer: Vec<u8, 64> = Vec::new();\nbuffer.push(42).unwrap(); // returns Err if full\n\nlet mut name: String<32> = String::new();\nname.push_str(""hello"").unwrap();\n\n// Fixed-size ring buffer:\nuse heapless::spsc::Queue;\nstatic mut Q: Queue<u8, 16> = Queue::new();","let mut buffer: Vec<u8> = Vec::new();\nbuffer.push(42); // requires allocator!\n// Vec is not available in #![no_std] without alloc",Critical,https://docs.rs/heapless/latest/heapless/
4,Async,Use embassy for async embedded,"Embassy provides an async runtime for embedded Rust with zero-allocation task scheduling","Use embassy-executor for async tasks; embassy-time for timers; embassy-stm32/nrf for HAL; #[embassy_executor::task] for concurrent tasks",Use busy-wait loops for multi-tasking; implement custom schedulers,"use embassy_executor::Spawner;\nuse embassy_time::{Duration, Timer};\n\n#[embassy_executor::main]\nasync fn main(spawner: Spawner) {\n    spawner.spawn(blink_led()).unwrap();\n    spawner.spawn(read_sensor()).unwrap();\n}\n\n#[embassy_executor::task]\nasync fn blink_led() {\n    let mut led = Output::new(p.PA5, Level::Low, Speed::Low);\n    loop {\n        led.toggle();\n        Timer::after(Duration::from_millis(500)).await;\n    }\n}","fn main() -> ! {\n    loop {\n        blink_led();\n        read_sensor();\n        // sequential: sensor blocks LED blinking\n    }\n}",High,https://embassy.dev/
5,Testing,Test embedded code on host with mocks,"Use embedded-hal-mock to test driver code on the host machine without hardware","Write drivers generic over embedded-hal traits; test with mocks on x86; use defmt for embedded logging",Only test on real hardware; skip testing embedded code entirely,"use embedded_hal_mock::eh1::i2c::{Mock as I2cMock, Transaction};\n\n#[test]\nfn test_sensor_read() {\n    let expectations = [\n        Transaction::write_read(0x48, vec![0x00], vec![0x01, 0x90]),\n    ];\n    let mut i2c = I2cMock::new(&expectations);\n\n    let temp = read_temperature(&mut i2c).unwrap();\n    assert_eq!(temp, 25.0);\n\n    i2c.done(); // verify all expectations met\n}","// Only testing on real hardware:\n// Must flash device, connect probe, read UART output\n// Cannot run in CI, cannot automate",High,https://docs.rs/embedded-hal-mock/latest/embedded_hal_mock/
