No,Category,Guideline,Description,Do,Dont,Code Good,Code Bad,Severity,Docs URL
1,Setup,Define services with tonic and protobuf,"Use .proto files to define gRPC services; generate Rust code with tonic-build in build.rs","Define messages and services in .proto; use tonic-build in build.rs; organize proto files by domain",Manually define message types; skip code generation,"// proto/user.proto:\nsyntax = ""proto3"";\npackage user;\nservice UserService {\n    rpc GetUser (GetUserRequest) returns (UserResponse);\n    rpc ListUsers (ListUsersRequest) returns (stream UserResponse);\n}\nmessage GetUserRequest { int64 id = 1; }\nmessage UserResponse { int64 id = 1; string name = 2; string email = 3; }\n\n// build.rs:\nfn main() {\n    tonic_build::compile_protos(""proto/user.proto"").unwrap();\n}","// Manually defining types:\nstruct GetUserRequest { id: i64 }\nstruct UserResponse { id: i64, name: String }\n// no serialization, no service definition\n// must manually implement encoding/decoding",Critical,https://docs.rs/tonic/latest/tonic/
2,Server,Implement gRPC server with tonic,"Implement the generated trait for your service; compose services with tonic's Server","Implement the generated trait; use tonic::Status for errors; add tower middleware layers; configure TLS",Return generic errors; skip health checking; ignore TLS for production,"use tonic::{Request, Response, Status};\nuse user::user_service_server::{UserService, UserServiceServer};\n\npub struct MyUserService { db: PgPool }\n\n#[tonic::async_trait]\nimpl UserService for MyUserService {\n    async fn get_user(&self, req: Request<GetUserRequest>) -> Result<Response<UserResponse>, Status> {\n        let id = req.into_inner().id;\n        let user = sqlx::query_as!(User, ""SELECT * FROM users WHERE id = $1"", id)\n            .fetch_optional(&self.db).await\n            .map_err(|e| Status::internal(e.to_string()))?\n            .ok_or_else(|| Status::not_found(""user not found""))?;\n        Ok(Response::new(UserResponse { id: user.id, name: user.name, email: user.email }))\n    }\n}\n\ntonic::transport::Server::builder()\n    .add_service(UserServiceServer::new(MyUserService { db }))\n    .serve(""0.0.0.0:50051"".parse()?).await?;","// Hardcoded response:\nasync fn get_user(&self, _req: Request<GetUserRequest>) -> Result<Response<UserResponse>, Status> {\n    Ok(Response::new(UserResponse { id: 1, name: ""test"".into(), email: """".into() }))\n}",High,https://docs.rs/tonic/latest/tonic/transport/struct.Server.html
3,Error Handling,Use tonic::Status for gRPC errors,"Map domain errors to appropriate gRPC status codes with descriptive messages","Use Status::not_found for 404; Status::invalid_argument for validation; Status::internal for server errors; add metadata for details",Use Status::internal for all errors; include stack traces in status messages,"fn to_status(err: AppError) -> tonic::Status {\n    match err {\n        AppError::NotFound(msg) => Status::not_found(msg),\n        AppError::Validation(msg) => Status::invalid_argument(msg),\n        AppError::Unauthorized => Status::unauthenticated(""invalid credentials""),\n        AppError::Internal(e) => {\n            tracing::error!(""gRPC internal: {e:?}"");\n            Status::internal(""internal error"")\n        }\n    }\n}","fn to_status(err: AppError) -> tonic::Status {\n    Status::internal(format!(""{err:?}""))\n    // all errors are Internal\n    // exposes debug info to client\n}",Critical,https://docs.rs/tonic/latest/tonic/struct.Status.html
4,Streaming,Implement server-side streaming,"Use tonic streaming for large result sets or real-time data feeds","Return a stream via tokio_stream; use mpsc channel for producer/consumer; handle client disconnection gracefully",Load all data into memory before sending,"#[tonic::async_trait]\nimpl UserService for MyUserService {\n    type ListUsersStream = ReceiverStream<Result<UserResponse, Status>>;\n\n    async fn list_users(&self, _req: Request<ListUsersRequest>) -> Result<Response<Self::ListUsersStream>, Status> {\n        let (tx, rx) = tokio::sync::mpsc::channel(32);\n        let db = self.db.clone();\n\n        tokio::spawn(async move {\n            let mut rows = sqlx::query_as!(User, ""SELECT * FROM users"").fetch(&db);\n            while let Some(Ok(user)) = rows.next().await {\n                if tx.send(Ok(UserResponse::from(user))).await.is_err() { break; }\n            }\n        });\n\n        Ok(Response::new(ReceiverStream::new(rx)))\n    }\n}","async fn list_users(&self, _req: Request<ListUsersRequest>) -> Result<Response<Self::ListUsersStream>, Status> {\n    let users: Vec<User> = sqlx::query_as!(User, ""SELECT * FROM users"")\n        .fetch_all(&self.db).await.unwrap();\n    // loads all users into memory before streaming\n}",High,https://docs.rs/tonic/latest/tonic/
5,Interceptor,Add auth interceptor for authentication,"Use tonic interceptors to verify auth tokens before requests reach the service","Extract metadata; verify tokens; reject unauthenticated requests with Status::unauthenticated",Skip auth on gRPC services; hardcode credentials,"use tonic::{service::interceptor, Request, Status};\n\nfn auth_interceptor(mut req: Request<()>) -> Result<Request<()>, Status> {\n    let token = req.metadata().get(""authorization"")\n        .and_then(|v| v.to_str().ok())\n        .ok_or_else(|| Status::unauthenticated(""missing token""))?;\n\n    let claims = verify_jwt(token)\n        .map_err(|_| Status::unauthenticated(""invalid token""))?;\n\n    req.extensions_mut().insert(claims);\n    Ok(req)\n}\n\nServer::builder()\n    .add_service(UserServiceServer::with_interceptor(svc, auth_interceptor))","// No auth:\nServer::builder()\n    .add_service(UserServiceServer::new(svc))\n// anyone can call any method",Critical,https://docs.rs/tonic/latest/tonic/service/trait.Interceptor.html
