No,Use Case,Keywords,Primary Package,Secondary Packages,Architecture Pattern,Error Strategy,Key Considerations
1,HTTP Server (Minimal),"http,server,rest,api,express,minimal",express,"cors,helmet,morgan,compression","Layered MVC or Module-per-Feature","Error middleware (app.use((err,req,res,next)=>{}))","Most ecosystem support; massive middleware library; not the fastest; add TypeScript types via @types/express"
2,HTTP Server (High Performance),"http,server,rest,api,fastify,performance",fastify,"@fastify/cors,@fastify/helmet,@fastify/swagger","Plugin architecture with encapsulation","setErrorHandler + schema validation errors","2-3x faster than Express; built-in JSON schema validation; TypeScript-first; plugin system with encapsulation"
3,Enterprise Backend Framework,"enterprise,nestjs,decorator,di,module",@nestjs/core,"@nestjs/common,@nestjs/platform-express,@nestjs/swagger","Hexagonal / Modular with Dependency Injection","ExceptionFilter with HttpException hierarchy","Full-featured; decorators + DI; opinionated structure; built-in microservices support; steep learning curve"
4,Full-Stack React SSR,"fullstack,react,ssr,nextjs,server components",next,"@auth/nextjs,@vercel/analytics,next-themes","App Router with Server Components","error.tsx boundaries + Route Handler try/catch","Dominant React meta-framework; Vercel hosting optimized; App Router = server-first; edge runtime support"
5,Schema Validation,"validation,schema,zod,parse,type-safe",zod,"@hookform/resolvers,zod-prisma-types","Used across all layers (controller → service → config)","ZodError with .flatten() or .format()","Runtime + compile-time validation; .parse() throws, .safeParse() returns result; compose schemas with .extend/.merge/.pick"
6,ORM (Type-Safe),"orm,database,prisma,schema,migration",prisma,"@prisma/client,prisma-zod-generator","Repository pattern or direct in service layer","PrismaClientKnownRequestError codes (P2002, P2025)","Auto-generated types from schema; migrations; excellent DX; connection pooling; raw SQL escape hatch"
7,ORM (Lightweight SQL),"orm,database,drizzle,sql,typescript",drizzle-orm,"drizzle-kit,drizzle-zod,pg","Repository or direct query builder","Standard try/catch on query execution","SQL-like API; zero overhead; push/pull migrations; supports pg/mysql/sqlite; smaller bundle than Prisma"
8,Query Builder,"query,builder,sql,knex,migration",knex,"objection,pg,mysql2","Repository pattern","Catch knex-specific error types","SQL query builder; supports transactions; migration system; used by Objection.js ORM; not type-safe without wrapper"
9,Authentication (Passport),"auth,passport,oauth,strategy,session",passport,"passport-local,passport-jwt,passport-google-oauth20","Middleware-based strategy pattern","Custom strategy error handling","200+ strategies; Express/Fastify compatible; session or JWT; mature but dated API; complex setup"
10,Authentication (Modern),"auth,lucia,session,cookie,modern",lucia,"@lucia-auth/adapter-prisma,oslo","Session-based with adapter pattern","Typed error classes (LuciaError)","Modern session auth; framework-agnostic; type-safe; Prisma/Drizzle adapters; replaces next-auth for custom needs"
11,Authentication (Next.js),"auth,nextauth,oauth,next,session",next-auth,"@auth/prisma-adapter,@auth/core","Next.js middleware + route handlers","Session callback error handling","Built for Next.js; OAuth providers out of box; Prisma adapter; v5 is Auth.js (framework-agnostic)"
12,Logging (Structured),"logging,pino,structured,json,fast",pino,"pino-pretty,pino-http,pino-multi-stream","Inject logger via DI or middleware","Log errors with context (req.log.error({err}))","Fastest Node.js logger; JSON output; child loggers for context; pino-http for request logging; 10x faster than winston"
13,Logging (Versatile),"logging,winston,transport,format",winston,"winston-daily-rotate-file,winston-transport","Inject via DI or global singleton","winston.error({message, stack, context})","Multiple transports; custom formats; log levels; file rotation; widely used but slower than pino"
14,Caching (Redis),"cache,redis,ioredis,session,pubsub",ioredis,"@upstash/redis,cache-manager","Cache-aside pattern in service layer","Catch ConnectionError; fallback to DB on cache miss","Cluster support; Lua scripting; pub/sub; pipeline; Upstash for serverless; connection pooling built-in"
15,Job Queue,"queue,background,job,bullmq,worker",bullmq,"bull-board,@bull-board/api","Worker pattern with dedicated queue processors","Job retry with exponential backoff; dead letter queue","Redis-backed; repeatable jobs; priority queues; rate limiting; bull-board for monitoring; concurrency control"
16,WebSocket (Feature-Rich),"websocket,realtime,socket.io,rooms,events",socket.io,"@socket.io/admin-ui,@socket.io/redis-adapter","Event-driven with rooms and namespaces","socket.on('error') + middleware error handling","Auto-reconnection; rooms; namespaces; binary support; Redis adapter for scaling; fallback to polling"
17,WebSocket (Lightweight),"websocket,ws,raw,performance",ws,"@types/ws,bufferutil,utf-8-validate","Raw WebSocket with custom protocol","ws.on('error') handler per connection","Fastest WS implementation; raw protocol; no abstraction overhead; good for custom protocols"
18,File Upload,"upload,file,multer,multipart,storage",multer,"@types/multer,multer-s3,sharp","Middleware in Express routes","Check file size/type in fileFilter callback","Multipart form handling; disk/memory/S3 storage; file size limits; type filtering; use sharp for image processing"
19,Email,"email,smtp,nodemailer,template",nodemailer,"@react-email/render,mjml,handlebars","Service pattern with template rendering","Catch SMTP errors; retry transient failures","SMTP/SES/Sendgrid transport; HTML templates; attachments; connection pooling; use react-email for modern templates"
20,PDF Generation,"pdf,generate,document,pdfkit",pdfkit,"@react-pdf/renderer,puppeteer","Service pattern with stream output","Pipe errors on writable stream","Programmatic PDF creation; streaming output; fonts/images; alternative: puppeteer for HTML→PDF"
21,Rate Limiting,"rate limit,throttle,ddos,protection",express-rate-limit,"@fastify/rate-limit,rate-limiter-flexible,ioredis","Middleware at route or global level","429 Too Many Requests response","IP-based or user-based; Redis store for distributed; sliding window; skip for trusted IPs"
22,GraphQL Server,"graphql,apollo,schema,resolver",@apollo/server,"graphql,@graphql-tools/schema,graphql-yoga","Schema-first or code-first resolvers","formatError hook for error sanitization","Apollo: most ecosystem; Yoga: lightweight alternative; DataLoader for N+1; subscription support"
23,Testing Framework,"test,vitest,unit,integration,mock",vitest,"@vitest/coverage-v8,@vitest/ui,happy-dom","Test files colocated with source","expect().toThrow() for error assertions","Vite-powered; Jest-compatible API; faster than Jest; native ESM; built-in coverage; watch mode"
24,E2E Testing,"e2e,browser,playwright,automation",@playwright/test,"playwright,@playwright/experimental-ct-react","Page Object Model pattern","expect(page).toHaveURL() + screenshot on failure","Multi-browser; auto-wait; trace viewer; parallel execution; component testing; codegen for recording"
25,CLI Framework,"cli,command,argument,commander",commander,"inquirer,chalk,ora","Command pattern with subcommands","exitOverride() for testable error handling","Most popular CLI framework; subcommands; options; auto-help; combine with inquirer for interactive prompts"
26,CLI Framework (Advanced),"cli,oclif,plugin,enterprise",oclif,"@oclif/core,@oclif/plugin-help","Plugin architecture with hooks","this.error() with exit codes","Salesforce-backed; plugin system; auto-generated docs; TypeScript-first; multi-command CLI"
27,Dependency Injection,"di,container,inject,tsyringe,ioc",tsyringe,"inversify,awilix,reflect-metadata","Constructor injection with decorators","Container resolution errors caught at startup","Lightweight DI; decorators-based; singleton/transient scopes; works with any framework; needs reflect-metadata"
28,HTTP Client,"http client,fetch,axios,request",ky,"axios,ofetch,undici","Service pattern wrapping HTTP calls","Interceptors for retry + error transformation","ky: tiny fetch wrapper; axios: feature-rich; ofetch: nuxt/nitro; undici: Node.js built-in HTTP/1.1 client"
29,Task Scheduling,"cron,schedule,recurring,job",node-cron,"cron,agenda,@nestjs/schedule","Scheduler service with job registry","Try/catch per job execution; log failures","Cron syntax; timezone support; use BullMQ for distributed cron; @nestjs/schedule for NestJS integration"
30,Monitoring (Metrics),"metrics,prometheus,monitoring,apm",prom-client,"@opentelemetry/sdk-node,newrelic,dd-trace","Middleware for request metrics + custom counters","Metric collection doesn't throw; fire-and-forget","Prometheus format; histogram for latency; counter for requests; OpenTelemetry for distributed tracing"
