No,Category,Guideline,Description,Do,Dont,Code Good,Code Bad,Severity,Docs URL
1,State,Use ViewModel with StateFlow,Manage UI state with ViewModel and StateFlow for lifecycle-aware reactive state,"Use StateFlow for state; collect with collectAsStateWithLifecycle; use sealed classes for UI state","Use LiveData in Compose; use mutableStateOf without ViewModel; pass state through many layers","@HiltViewModel\nclass ProductViewModel @Inject constructor(\n    private val repository: ProductRepository\n) : ViewModel() {\n    private val _state = MutableStateFlow(ProductUiState())\n    val state: StateFlow<ProductUiState> = _state.asStateFlow()\n    \n    fun loadProducts() {\n        viewModelScope.launch {\n            _state.update { it.copy(isLoading = true) }\n            repository.getProducts().fold(\n                onSuccess = { products -> _state.update { it.copy(products = products, isLoading = false) } },\n                onFailure = { error -> _state.update { it.copy(error = error.message, isLoading = false) } }\n            )\n        }\n    }\n}\n\n@Composable\nfun ProductScreen(viewModel: ProductViewModel = hiltViewModel()) {\n    val state by viewModel.state.collectAsStateWithLifecycle()\n}","// Mutable state directly in Composable\n@Composable\nfun ProductScreen() {\n    var products by remember { mutableStateOf(emptyList<Product>()) }\n    LaunchedEffect(Unit) {\n        products = api.getProducts() // No error handling\n    }\n}",High,https://developer.android.com/topic/architecture/ui-layer/stateholders
2,Navigation,Use Type-Safe Navigation with Compose,Navigate with type-safe routes using Kotlin serialization and NavHost,"Use @Serializable route classes; type-safe arguments; handle deep links","Use string-based routes; pass complex objects as JSON strings","@Serializable\ndata class ProductRoute(val productId: String)\n@Serializable\nobject HomeRoute\n\n@Composable\nfun AppNavHost(navController: NavHostController = rememberNavController()) {\n    NavHost(navController = navController, startDestination = HomeRoute) {\n        composable<HomeRoute> {\n            HomeScreen(onProductClick = { navController.navigate(ProductRoute(it.id)) })\n        }\n        composable<ProductRoute> { backStackEntry ->\n            val route = backStackEntry.toRoute<ProductRoute>()\n            ProductScreen(productId = route.productId)\n        }\n    }\n}","navController.navigate('product/${product.id}')\n// String-based, no type safety, easy to break",Medium,https://developer.android.com/guide/navigation/compose
3,DI,Use Hilt for Dependency Injection,Use Hilt (Dagger wrapper) for compile-time dependency injection in Android,"Annotate with @HiltViewModel @Inject @Module; use @Provides for third-party deps","Use manual DI; use Koin in large projects where compile-time safety matters","@Module\n@InstallIn(SingletonComponent::class)\nobject NetworkModule {\n    @Provides\n    @Singleton\n    fun provideOkHttp(): OkHttpClient = OkHttpClient.Builder()\n        .addInterceptor(AuthInterceptor())\n        .build()\n    \n    @Provides\n    @Singleton\n    fun provideRetrofit(okHttp: OkHttpClient): Retrofit = Retrofit.Builder()\n        .baseUrl(BuildConfig.BASE_URL)\n        .client(okHttp)\n        .addConverterFactory(MoshiConverterFactory.create())\n        .build()\n}","// Manual creation everywhere\nval okHttp = OkHttpClient()\nval retrofit = Retrofit.Builder().client(okHttp).build()\nval api = retrofit.create(ProductApi::class.java)\n// Not testable, not injectable",High,https://developer.android.com/training/dependency-injection/hilt-android
4,Composable,Follow Composable Best Practices,Write reusable testable Composables following Compose conventions,"Use slot APIs; hoist state; keep Composables stateless; use Modifier parameter","Create stateful composables; hardcode sizes; skip Modifier parameter","@Composable\nfun AppButton(\n    text: String,\n    onClick: () -> Unit,\n    modifier: Modifier = Modifier,\n    isLoading: Boolean = false,\n    enabled: Boolean = true,\n) {\n    Button(\n        onClick = onClick,\n        modifier = modifier,\n        enabled = enabled && !isLoading,\n    ) {\n        if (isLoading) {\n            CircularProgressIndicator(modifier = Modifier.size(20.dp))\n        } else {\n            Text(text)\n        }\n    }\n}","@Composable\nfun AppButton(text: String) {\n    // No modifier parameter - can't customize from outside\n    // No loading state\n    // Hardcoded size\n    Button(onClick = { /* hardcoded action */ }) { Text(text) }\n}",Medium,https://developer.android.com/develop/ui/compose/kotlin
5,Performance,Optimize Composition and Recomposition,Minimize recompositions using stable types derivedStateOf and remember,"Use @Stable/@Immutable annotations; use derivedStateOf; use key() for lists; profile with Layout Inspector","Pass lambdas without remember; use unstable types in state; recompose entire screens","@Composable\nfun ProductList(products: List<Product>, onProductClick: (Product) -> Unit) {\n    val sortedProducts by remember(products) {\n        derivedStateOf { products.sortedBy { it.name } }\n    }\n    \n    LazyColumn {\n        items(sortedProducts, key = { it.id }) { product ->\n            ProductCard(\n                product = product,\n                onClick = { onProductClick(product) }\n            )\n        }\n    }\n}","LazyColumn {\n    items(products) { product ->\n        // No key - recomposes everything on list change\n        // Lambda recreated every recomposition\n        ProductCard(product, { nav.navigate('...') })\n    }\n}",High,https://developer.android.com/develop/ui/compose/performance
6,Data,Use Room with Kotlin Flows,Local persistence with Room database emitting Kotlin Flows for reactive UI updates,"Use @Dao with Flow returns; define entities with @Entity; use migrations","Return LiveData from Room; skip migrations; query on main thread","@Dao\ninterface ProductDao {\n    @Query('SELECT * FROM products ORDER BY name')\n    fun observeAll(): Flow<List<ProductEntity>>\n    \n    @Upsert\n    suspend fun upsertAll(products: List<ProductEntity>)\n    \n    @Query('SELECT * FROM products WHERE id = :id')\n    suspend fun getById(id: String): ProductEntity?\n}\n\n@Database(entities = [ProductEntity::class], version = 2)\nabstract class AppDatabase : RoomDatabase() {\n    abstract fun productDao(): ProductDao\n}","@Dao\ninterface ProductDao {\n    @Query('SELECT * FROM products')\n    fun getAll(): List<ProductEntity> // Blocks main thread!\n    // No Flow, no reactive updates\n}",Medium,https://developer.android.com/training/data-storage/room
7,Testing,Test Composables with ComposeTestRule,Test Compose UI with ComposeTestRule for reliable assertions and interactions,"Use createComposeRule; find by testTag/text/role; use performClick; wait for idle","Test only ViewModels; skip Compose UI tests; use Espresso for Compose screens","@Test\nfun productCard_displaysNameAndPrice() {\n    composeTestRule.setContent {\n        ProductCard(product = Product('Laptop', 999.99))\n    }\n    \n    composeTestRule.onNodeWithText('Laptop').assertIsDisplayed()\n    composeTestRule.onNodeWithText('$999.99').assertIsDisplayed()\n    composeTestRule.onNodeWithTag('add_to_cart').performClick()\n    composeTestRule.onNodeWithText('Added!').assertIsDisplayed()\n}","// No Compose tests\n// Only ViewModel unit tests\n// Missing UI interaction verification",Medium,https://developer.android.com/develop/ui/compose/testing
8,Theming,Use MaterialTheme with Dynamic Colors,Configure Material 3 theme with dynamic color support and custom color schemes,"Use MaterialTheme with colorScheme; support dynamic colors on Android 12+; define typography","Hardcode colors in composables; skip dark theme; ignore dynamic colors","@Composable\nfun AppTheme(darkTheme: Boolean = isSystemInDarkTheme(), content: @Composable () -> Unit) {\n    val colorScheme = when {\n        Build.VERSION.SDK_INT >= 31 && darkTheme -> dynamicDarkColorScheme(LocalContext.current)\n        Build.VERSION.SDK_INT >= 31 -> dynamicLightColorScheme(LocalContext.current)\n        darkTheme -> darkColorScheme(primary = Purple80)\n        else -> lightColorScheme(primary = Purple40)\n    }\n    MaterialTheme(colorScheme = colorScheme, typography = AppTypography, content = content)\n}","// Hardcoded colors\nText('Hello', color = Color(0xFF333333)) // No theme support",Medium,https://developer.android.com/develop/ui/compose/designsystems/material3
